Sheet: Template
A1: Template (Deluxe)
B3: Amount | C3: Unit | E3: kcal | F3: Fat | G3: Carbs | H3: Sugar | I3: Protein | J3: Salt
A4: Nutritional values per 100g/ml | B4: 100 | C4: g | E4: of:=[.E6]/[.$B6]*[.$B4] -> 40 | F4: of:=[.F6]/[.$B6]*[.$B4] -> 0 | G4: of:=[.G6]/[.$B6]*[.$B4] -> 80 | H4: of:=[.H6]/[.$B6]*[.$B4] -> 0 | I4: of:=[.I6]/[.$B6]*[.$B4] -> 0 | J4: of:=[.J6]/[.$B6]*[.$B4] -> 0
A5: Nutritional values per ½ Deluxe Tub | B5: 340 | C5: g | E5: of:=[.E6]/[.$B6]*[.$B5] -> 136 | F5: of:=[.F6]/[.$B6]*[.$B5] -> 0 | G5: of:=[.G6]/[.$B6]*[.$B5] -> 272 | H5: of:=[.H6]/[.$B6]*[.$B5] -> 0 | I5: of:=[.I6]/[.$B6]*[.$B5] -> 0 | J5: of:=[.J6]/[.$B6]*[.$B5] -> 0
A6: Nutritional values total | B6: of:=SUMPRODUCT([.$B21:.$B509];[.$O21:.$O509]) -> 0.1 | C6: g | E6: of:=SUMPRODUCT([.$B21:.$B509];[.E21:.E509];[.$O21:.$O509])/100 -> 0.04 | F6: of:=SUMPRODUCT([.$B21:.$B509];[.F21:.F509];[.$O21:.$O509])/100 -> 0 | G6: of:=SUMPRODUCT([.$B21:.$B509];[.G21:.G509];[.$O21:.$O509])/100 -> 0.08 | H6: of:=SUMPRODUCT([.$B21:.$B509];[.H21:.H509];[.$O21:.$O509])/100 -> 0 | I6: of:=SUMPRODUCT([.$B21:.$B509];[.I21:.I509];[.$O21:.$O509])/100 -> 0 | J6: of:=SUMPRODUCT([.$B21:.$B509];[.J21:.J509];[.$O21:.$O509])/100 -> 0
A8: FPDF / PAC (target 20..30) | B8: of:=SUMPRODUCT([.$B21:.$B509];[.$K21:.$K509];[.$O21:.$O509])/[.$B$6]*100+5.9*[.$J$4] -> 190
A9: Protein / Energy Ratio (ok=12%; hi=20%) | B9: of:=[.I4]*4/[.E4] -> 0 | E9: of:=IF([.E4]>40;"";"LOW-CAL") -> LOW-CAL | F9: of:=IF([.F4]>3;"";"LOW-FAT") -> LOW-FAT | H9: of:=IF([.H4]>5;"";"Low-Sugar") -> Low-Sugar | I9: of:=IF([.B9]>0.2;"Hi-Protein";"") ->  | J9: of:=IF([.J4]>0.12;"";"Low-Salt") -> Low-Salt
A10: ℹ️ Milk Solids Non-Fat (MSNF, 7-11%) | B10: of:=SUMPRODUCT([.$B21:.$B509];[.$L21:.$L509];[.$O21:.$O509])/100 -> 0 | C10: g | E10: of:=[.B10]/[.B6] -> 0
A11: ℹ️ Net carbs | B11: of:=[.$G$6]-SUMPRODUCT([.$B21:.$B509];[.$N21:.$N509];[.$O21:.$O509])/100 -> 0 | C11: g | E11: of:=COM.MICROSOFT.CONCAT("*∝ 5 servings@";ROUND([.$B$6]/5;0);"g:* ";ROUND([.$B11]/5;1);"g") -> *∝ 5 servings@0g:* 0g | H11: of:=COM.MICROSOFT.CONCAT("*∝ 3 servings@";ROUND([.$B$6]/3;0);"g:* ";ROUND([.$B11]/3;1);"g") -> *∝ 3 servings@0g:* 0g | K11: of:=COM.MICROSOFT.CONCAT("*energy ratio (low <20%):* ";ROUND([.$B11]*4/[.$E$6]*100;1);"%") -> *energy ratio (low <20%):* 0%
A12: INTRO
A13: Spin on “Sorbet”, scrape down, and re-mix.
A16: Rating: 😋 (untested) <!-- SNIPPET: alcohol →
A18: The [brand names] used are in brackets.
A20: Ingredients | B20: Amount | C20: Unit | D20: # | E20: kcal | F20: Fat | G20: Carbs | H20: Sugar | I20: Protein | J20: Salt | K20: FPDF | L20: MSNF | M20: Comment | N20: 0Carb[%] | O20: Counts?
A21: ❔Turmeric | C21: pinch | D21: 2 | M21: *optional*, for color | O21: of:=COM.MICROSOFT.IFS([.D21]>3;"";[.C21]="g";1;[.C21]="ml";1;1;"") -> 
A22: Aceto balsamico di Modena [Due Vittorie] | C22: ml | D22: 5 | E22: 317 | G22: 78 | H22: 78 | I22: 0.8 | K22: of:=[.H22]/100 -> 0.78 | M22: of:=COM.MICROSOFT.CONCAT("add as a topping [";ROUND([.E22]*[.B22]/100); "kcal, ";ROUND([.H22]*[.B22]/100;1); "g sugar]") -> add as a topping [0kcal, 0g sugar]
A23: Agave syrup | C23: ml | D23: 1 | E23: 313 | F23: 0.5 | G23: 77 | H23: 77 | I23: 0.5 | J23: 0 | K23: 1.8 | M23: POD ≈160; GI=11 | O23: of:=COM.MICROSOFT.IFS([.D23]>3;"";[.C23]="g";1;[.C23]="ml";1;1;"") -> 1
A24: Allulose | B24: 0.1 | C24: g | D24: 2 | E24: 40 | G24: 80 | K24: 1.9 | M24: of:=COM.MICROSOFT.CONCAT("*alternative:* ";ROUND([.B24]/1.33);"g SweEX (Erythritol + Xylitol 3:2)") -> *alternative:* 0g SweEX (Erythritol + Xylitol 3:2) | N24: 80 | O24: of:=COM.MICROSOFT.IFS([.D24]>3;"";[.C24]="g";1;[.C24]="ml";1;1;"") -> 1
A25: Almond butter (creamy) [Seba Garden] | C25: g | D25: 1 | E25: 598 | F25: 52.54 | G25: 10.11 | H25: 4.86 | I25: 21.15 | J25: 0.01 | K25: of:=[.H25]/100 -> 0.0486 | O25: of:=COM.MICROSOFT.IFS([.D25]>3;"";[.C25]="g";1;[.C25]="ml";1;1;"") -> 1
A26: Almond Liqueur 21.5 vol% [Casella Amaretto] | C26: ml | D26: 1 | E26: 191 | F26: 0 | G26: 18.1 | H26: 18 | I26: 0 | K26: of:=[.H26]/100+0.215*0.789*7.4 -> 1.435299 | M26: 1 bottle = 700ml | O26: of:=COM.MICROSOFT.IFS([.D26]>3;"";[.C26]="g";1;[.C26]="ml";1;1;"") -> 1
A27: Almond milk 1.7% (sugar-free) [REWE Bio] | C27: ml | D27: 1 | E27: 19 | F27: 1.7 | G27: 0 | H27: 0 | I27: 0.8 | J27: 0.15 | M27: with guar gum (<1.5g) | O27: of:=COM.MICROSOFT.IFS([.D27]>3;"";[.C27]="g";1;[.C27]="ml";1;1;"") -> 1
A28: Almond milk 2.5% (sugar-free) | C28: ml | D28: 1 | E28: 29 | F28: 2.5 | G28: 0.5 | H28: 0 | I28: 1 | J28: 0.1 | O28: of:=COM.MICROSOFT.IFS([.D28]>3;"";[.C28]="g";1;[.C28]="ml";1;1;"") -> 1
A29: Almond slivers [naturix24] | C29: g | D29: 4 | E29: 589 | F29: 54 | G29: 5 | H29: 4 | I29: 22 | M29: of:=COM.MICROSOFT.CONCAT("add as a topping or mix-in [";ROUND([.E29]*[.B29]/100); "kcal, ";ROUND([.H29]*[.B29]/100;1); "g sugar]") -> add as a topping or mix-in [0kcal, 0g sugar]
A30: Amarettini [REWE/Gadeschi] | C30: g | D30: 4 | E30: 416 | F30: 6.2 | G30: 82 | H30: 65 | I30: 6.5 | J30: 0.25 | M30: of:=COM.MICROSOFT.CONCAT("10 pcs = 13.8g; add as a topping or mix-in [";ROUND([.E30]*[.B30]/100); "kcal, ";ROUND([.H30]*[.B30]/100;1); "g sugar]") -> 10 pcs = 13.8g; add as a topping or mix-in [0kcal, 0g sugar]
A31: Amaretto 28 vol% | C31: ml | D31: 1 | E31: 282 | G31: 30 | H31: 30 | K31: of:=[.H31]/100+0.28*0.789*7.4 -> 1.934808 | O31: of:=COM.MICROSOFT.IFS([.D31]>3;"";[.C31]="g";1;[.C31]="ml";1;1;"") -> 1
A32: Anatto Seed Powder [Naturix24] | C32: g | D32: 2 | E32: 144 | F32: 2 | G32: 28 | I32: 6 | M32: optional, for color | O32: of:=COM.MICROSOFT.IFS([.D32]>3;"";[.C32]="g";1;[.C32]="ml";1;1;"") -> 1
A33: Apple Juice | C33: ml | D33: 1 | E33: 51 | F33: 0 | G33: 11.81 | H33: 10.97 | I33: 0 | J33: 0.01 | K33: of:=[.H33]/100 -> 0.1097 | O33: of:=COM.MICROSOFT.IFS([.D33]>3;"";[.C33]="g";1;[.C33]="ml";1;1;"") -> 1
A34: Apple Sauce (no added sugar) [Gut Bio/Aldi] | C34: ml | D34: 1 | E34: 52 | F34: 0.5 | G34: 12 | H34: 10 | I34: 0.5 | J34: 0.01 | K34: of:=[.H34]/100 -> 0.1 | M34: 1 jar = 355g | O34: of:=COM.MICROSOFT.IFS([.D34]>3;"";[.C34]="g";1;[.C34]="ml";1;1;"") -> 1
A35: Apricots (canned) [Del Monte] | C35: g | D35: 1 | E35: 60 | F35: 0 | G35: 14 | H35: 12 | I35: 0.4 | J35: 0.07 | K35: of:=[.H35]/100 -> 0.12 | O35: of:=COM.MICROSOFT.IFS([.D35]>3;"";[.C35]="g";1;[.C35]="ml";1;1;"") -> 1
A36: Aquafaba (chickpea liquid) | C36: ml | D36: 1 | E36: 30 | F36: 0.5 | G36: 3 | H36: 0.5 | I36: 1 | J36: 0.01 | O36: of:=COM.MICROSOFT.IFS([.D36]>3;"";[.C36]="g";1;[.C36]="ml";1;1;"") -> 1
A37: Avocado oil (extra virgin) [Hunter & Gather] | C37: ml | D37: 1 | E37: 819 | F37: 91 | O37: of:=COM.MICROSOFT.IFS([.D37]>3;"";[.C37]="g";1;[.C37]="ml";1;1;"") -> 1
A38: Avocado pulp (fresh) | C38: g | D38: 1 | E38: 160 | F38: 15 | G38: 8.5 | H38: 0.7 | I38: 2 | J38: 0.01 | M38: ~73% water | O38: of:=COM.MICROSOFT.IFS([.D38]>3;"";[.C38]="g";1;[.C38]="ml";1;1;"") -> 1
A39: Azuki Beans (小豆 organic red beans) [Rapunzel] | C39: g | D39: 0 | E39: 304 | F39: 1.2 | G39: 42 | H39: 3.1 | I39: 23 | J39: 0.02 | O39: of:=COM.MICROSOFT.IFS([.D39]>3;"";[.C39]="g";1;[.C39]="ml";1;1;"") -> 1
A40: Bananas (peeled) | C40: g | D40: 1 | E40: 108 | F40: 0.6 | G40: 21.5 | H40: 16 | I40: 1.22 | J40: 0.03 | K40: of:=[.H40]/100 -> 0.16 | O40: of:=COM.MICROSOFT.IFS([.D40]>3;"";[.C40]="g";1;[.C40]="ml";1;1;"") -> 1
A41: Batida de Côco 16 vol% [Mangaroca] | C41: ml | D41: 1 | E41: 238 | F41: 0.5 | G41: 29 | H41: 16 | I41: 2.4 | K41: of:=[.H41]/100+0.16*0.789*7.4 -> 1.094176 | M41: 1 bottle = 700ml | O41: of:=COM.MICROSOFT.IFS([.D41]>3;"";[.C41]="g";1;[.C41]="ml";1;1;"") -> 1
A42: Beet Root Powder (organic) [Mandoi] | C42: g | D42: 2 | E42: 347 | F42: 1 | G42: 70 | H42: 46 | I42: 14.1 | J42: 0.1 | M42: *optional*, for color | O42: of:=COM.MICROSOFT.IFS([.D42]>3;"";[.C42]="g";1;[.C42]="ml";1;1;"") -> 1
A43: Biscoff “Lotus” cookies [Aldi] | C43: g | D43: 4 | E43: 484 | F43: 19 | G43: 72.6 | H43: 38.1 | I43: 4.9 | J43: 0.92 | K43: of:=[.H43]/100 -> 0.381 | M43: 1pc = 7.8g | O43: of:=COM.MICROSOFT.IFS([.D43]>3;"";[.C43]="g";1;[.C43]="ml";1;1;"") -> 
A44: Black sesame seeds, roasted [Emma Basic] | C44: g | D44: 4 | E44: 597 | F44: 51 | G44: 2.5 | H44: 1.1 | I44: 25 | J44: 0 | M44: Mix-in for a full tub (2 servings) | O44: of:=COM.MICROSOFT.IFS([.D44]>3;"";[.C44]="g";1;[.C44]="ml";1;1;"") -> 
A45: Blueberries (canned) [REWE] | C45: g | D45: 1 | E45: 82 | F45: 0.5 | G45: 16.2 | H45: 16.2 | I45: 0.5 | J45: 0 | K45: of:=[.H45]/100 -> 0.162 | O45: of:=COM.MICROSOFT.IFS([.D45]>3;"";[.C45]="g";1;[.C45]="ml";1;1;"") -> 1
A46: Blueberries (frozen) | C46: g | D46: 1 | E46: 48 | F46: 0.4 | G46: 9.1 | H46: 8.9 | I46: 0.4 | J46: 0 | K46: of:=[.H46]/100 -> 0.089 | O46: of:=COM.MICROSOFT.IFS([.D46]>3;"";[.C46]="g";1;[.C46]="ml";1;1;"") -> 1
A47: Blueberry powder [Bio Leis] | C47: g | D47: 2 | E47: 360 | F47: 5.1 | G47: 60.1 | H47: 51.1 | I47: 5.1 | J47: 0.02 | K47: of:=[.H47]/100 -> 0.511 | O47: of:=COM.MICROSOFT.IFS([.D47]>3;"";[.C47]="g";1;[.C47]="ml";1;1;"") -> 1
A48: Brandy or Vodka 40 vol% | C48: g | D48: 1 | E48: 280 | K48: of:=7.4*0.4 -> 2.96 | M48: of:=COM.MICROSOFT.CONCAT("*alternative:* ";ROUND([.B48]*0.8);"g (additional) VG for a sober recipe") -> *alternative:* 0g (additional) VG for a sober recipe | O48: of:=COM.MICROSOFT.IFS([.D48]>3;"";[.C48]="g";1;[.C48]="ml";1;1;"") -> 1
A49: Butter | C49: g | D49: 1 | E49: 731 | F49: 82 | G49: 0.8 | H49: 0.8 | I49: 0.6 | J49: 0.03 | O49: of:=COM.MICROSOFT.IFS([.D49]>3;"";[.C49]="g";1;[.C49]="ml";1;1;"") -> 1
A50: Buttermilk 1% [REWE] | C50: ml | D50: 1 | E50: 35 | F50: 0.5 | G50: 4 | H50: 4 | I50: 3.5 | J50: 0.15 | K50: of:=[.H50]/100 -> 0.04 | L50: of:=9-[.F50] -> 8.5 | O50: of:=COM.MICROSOFT.IFS([.D50]>3;"";[.C50]="g";1;[.C50]="ml";1;1;"") -> 1
A51: Candied Lemon Peel | C51: g | D51: 1 | E51: 321 | F51: 0.3 | G51: 78 | H51: 77 | I51: 0.1 | J51: 0.5 | K51: 0.1 | O51: of:=COM.MICROSOFT.IFS([.D51]>3;"";[.C51]="g";1;[.C51]="ml";1;1;"") -> 1
A52: Candied Orange Peel | C52: g | D52: 1 | E52: 314 | F52: 0.5 | G52: 76 | H52: 76 | I52: 0.5 | J52: 0.63 | K52: 0.1 | O52: of:=COM.MICROSOFT.IFS([.D52]>3;"";[.C52]="g";1;[.C52]="ml";1;1;"") -> 1
A53: Cantuccini (organic, with dinkel) [dm Bio] | C53: g | D53: 4 | E53: 444 | F53: 18 | G53: 59 | H53: 26 | I53: 9.4 | J53: 0.16 | K53: of:=[.H53]/100 -> 0.26 | M53: 150g bag; 1pc ~5g | O53: of:=COM.MICROSOFT.IFS([.D53]>3;"";[.C53]="g";1;[.C53]="ml";1;1;"") -> 
A54: Carboxymethyl Cellulose (CMC / E466) [GoodBake] | C54: g | D54: 2 | E54: 600 | G54: 75 | O54: of:=COM.MICROSOFT.IFS([.D54]>3;"";[.C54]="g";1;[.C54]="ml";1;1;"") -> 1
A55: Carob powder (organic) [Rapunzel] | C55: g | D55: 2 | E55: 302.6 | F55: 0.5 | G55: 51.6 | H55: 31.7 | I55: 5 | J55: 0.02 | K55: of:=[.H55]/100 -> 0.317 | M55: Low-fat cacao substitute | O55: of:=COM.MICROSOFT.IFS([.D55]>3;"";[.C55]="g";1;[.C55]="ml";1;1;"") -> 1
A56: Casein (unflavored) [Bulk] | C56: g | D56: 2 | E56: 356 | F56: 0.7 | G56: 5.5 | H56: 2.7 | I56: 82 | J56: 0.15 | K56: of:=[.H56]/100 -> 0.027 | O56: of:=COM.MICROSOFT.IFS([.D56]>3;"";[.C56]="g";1;[.C56]="ml";1;1;"") -> 1
A57: Cashew milk 1.1% (low-sugar) [alpro] | C57: ml | D57: 1 | E57: 23 | F57: 1.1 | G57: 2.6 | H57: 2 | I57: 0.5 | J57: 0.13 | O57: of:=COM.MICROSOFT.IFS([.D57]>3;"";[.C57]="g";1;[.C57]="ml";1;1;"") -> 1
A58: Cashew nuts (organic) [Biojoy] | C58: g | D58: 5 | E58: 603 | F58: 48.3 | G58: 16.1 | H58: 5.7 | I58: 20.7 | J58: 0 | K58: of:=[.H58]/100 -> 0.057 | M58: of:=COM.MICROSOFT.CONCAT("add as a topping [";ROUND([.E58]*[.B58]/100); "kcal, ";ROUND([.H58]*[.B58]/100;1); "g sugar]") -> add as a topping [0kcal, 0g sugar] | O58: of:=COM.MICROSOFT.IFS([.D58]>3;"";[.C58]="g";1;[.C58]="ml";1;1;"") -> 
A59: Chartreuse jaune 43 vol% | C59: g | D59: 1 | E59: 370 | G59: 30.6 | H59: 30.6 | K59: of:=[.H59]/100+0.43*0.789*7.4 -> 2.816598 | O59: of:=COM.MICROSOFT.IFS([.D59]>3;"";[.C59]="g";1;[.C59]="ml";1;1;"") -> 1
A60: Chartreuse verde 55 vol% | C60: g | D60: 1 | E60: 400 | G60: 22.5 | H60: 22.5 | K60: of:=[.H60]/100+0.55*0.789*7.4 -> 3.43623 | O60: of:=COM.MICROSOFT.IFS([.D60]>3;"";[.C60]="g";1;[.C60]="ml";1;1;"") -> 1
A61: Cherries | C61: g | D61: 1 | E61: 61 | F61: 0.1 | G61: 13.6 | H61: 9.6 | I61: 0.9 | J61: 0 | K61: of:=[.H61]/100 -> 0.096 | O61: of:=COM.MICROSOFT.IFS([.D61]>3;"";[.C61]="g";1;[.C61]="ml";1;1;"") -> 1
A62: Cherries, Sour (dried, pitted) [Biojoy] | C62: g | D62: 1 | E62: 295 | F62: 0.22 | G62: 66.6 | H62: 57.4 | I62: 3.4 | J62: 0.03 | K62: of:=[.H62]/100 -> 0.574 | M62: ≈20% water remaining | O62: of:=COM.MICROSOFT.IFS([.D62]>3;"";[.C62]="g";1;[.C62]="ml";1;1;"") -> 1
A63: Chia seeds [Mr. Brown] | C63: g | D63: 2 | E63: 444 | F63: 31.1 | G63: 4.5 | H63: 0.8 | I63: 21.2 | J63: 0.03 | O63: of:=COM.MICROSOFT.IFS([.D63]>3;"";[.C63]="g";1;[.C63]="ml";1;1;"") -> 1
A64: Chickpeas (organic) | C64: g | D64: 1 | E64: 420 | F64: 0.3 | G64: 15.4 | H64: 1 | I64: 5.9 | J64: 0.6 | M64: can: 258/400g | O64: of:=COM.MICROSOFT.IFS([.D64]>3;"";[.C64]="g";1;[.C64]="ml";1;1;"") -> 1
A65: Chicory syrup [Vilgain] | C65: ml | D65: 4 | E65: 162 | G65: 6 | H65: 6 | M65: 69% fiber (inulin) | O65: of:=COM.MICROSOFT.IFS([.D65]>3;"";[.C65]="g";1;[.C65]="ml";1;1;"") -> 
A66: Cinnamon (Ceylon) | C66: g | D66: 2 | M66: to taste; 1tsp = 3g | O66: of:=COM.MICROSOFT.IFS([.D66]>3;"";[.C66]="g";1;[.C66]="ml";1;1;"") -> 1
A67: Citric Acid | C67: g | D67: 2 | E67: 391 | F67: 0.15 | G67: 97 | H67: 0 | I67: 0.5 | J67: 0.5 | M67: 0.5–1g ≈ 15ml lemon juice | O67: of:=COM.MICROSOFT.IFS([.D67]>3;"";[.C67]="g";1;[.C67]="ml";1;1;"") -> 1
A68: Cocoa Noir Intense 11% [Cacao Barry] | C68: g | D68: 0 | E68: 310.46 | F68: 11 | G68: 13 | H68: 0.5 | I68: 22 | J68: 4.1 | K68: -1.3 | M68: intense, tart cocoa flavour | O68: of:=COM.MICROSOFT.IFS([.D68]>3;"";[.C68]="g";1;[.C68]="ml";1;1;"") -> 1
A69: Cocoa Powder 21% [Bensdorp Premium] | C69: g | D69: 0 | E69: 366 | F69: 21 | G69: 8.9 | H69: 0.6 | I69: 20 | J69: 0.1 | K69: -1.6 | O69: of:=COM.MICROSOFT.IFS([.D69]>3;"";[.C69]="g";1;[.C69]="ml";1;1;"") -> 1
A70: Cocoa Powder 21% [cebe] | C70: g | D70: 0 | E70: 358 | F70: 20.7 | G70: 8.8 | H70: 0.5 | I70: 19.8 | J70: 0.08 | K70: -1.6 | O70: of:=COM.MICROSOFT.IFS([.D70]>3;"";[.C70]="g";1;[.C70]="ml";1;1;"") -> 1
A71: Cocoa Powder Organic 11% [Sevenhills] | C71: g | D71: 0 | E71: 367 | F71: 11 | G71: 26.8 | H71: 0.9 | I71: 28 | J71: 0.05 | K71: -1.3 | O71: of:=COM.MICROSOFT.IFS([.D71]>3;"";[.C71]="g";1;[.C71]="ml";1;1;"") -> 1
A72: Coconut flakes (desiccated) [Biojoy] | C72: g | D72: 0 | E72: 660 | F72: 63 | G72: 6.4 | H72: 6.4 | I72: 6.2 | J72: 0.08 | K72: of:=[.H72]/100 -> 0.064 | O72: of:=COM.MICROSOFT.IFS([.D72]>3;"";[.C72]="g";1;[.C72]="ml";1;1;"") -> 1
A73: Coconut Milk (unsweetened) [Thai Kitchen] | C73: ml | D73: 1 | E73: 150 | F73: 15 | G73: 1.25 | H73: 1.25 | I73: 0.9 | J73: 0 | M73: US brand | O73: of:=COM.MICROSOFT.IFS([.D73]>3;"";[.C73]="g";1;[.C73]="ml";1;1;"") -> 1
A74: Coconut milk 22% [REWE Bio] | C74: ml | D74: 1 | E74: 222 | F74: 22 | G74: 4 | H74: 4 | I74: 2 | J74: 0.04 | K74: of:=[.H74]/100 -> 0.04 | O74: of:=COM.MICROSOFT.IFS([.D74]>3;"";[.C74]="g";1;[.C74]="ml";1;1;"") -> 1
A75: Coconut Milk Powder 54% [Green Essence] | C75: g | D75: 2 | E75: 640 | F75: 55 | G75: 40.25 | H75: 1.25 | I75: 6.25 | J75: 0.13 | L75: 46.5 | O75: of:=COM.MICROSOFT.IFS([.D75]>3;"";[.C75]="g";1;[.C75]="ml";1;1;"") -> 1
A76: Coconut Oil | C76: ml | D76: 1 | E76: 828 | F76: 92 | G76: 0.5 | H76: 0.5 | I76: 0.5 | J76: 0.01 | K76: -0.9 | O76: of:=COM.MICROSOFT.IFS([.D76]>3;"";[.C76]="g";1;[.C76]="ml";1;1;"") -> 1
A77: Coffee (instant) | C77: g | D77: 2 | E77: 118 | F77: 0.2 | G77: 3.1 | H77: 3.1 | I77: 7 | J77: 0.25 | O77: of:=COM.MICROSOFT.IFS([.D77]>3;"";[.C77]="g";1;[.C77]="ml";1;1;"") -> 1
A78: Coffee Liqueur 25 vol% [Caffè Borghetti] | C78: ml | D78: 1 | E78: 240 | F78: 0 | G78: 23 | H78: 23 | I78: 0 | K78: of:=[.H78]/100+0.25*0.789*7.4 -> 1.68965 | M78: 1 bottle = 700ml | O78: of:=COM.MICROSOFT.IFS([.D78]>3;"";[.C78]="g";1;[.C78]="ml";1;1;"") -> 1
A79: Cointreau 40 vol% | C79: g | D79: 1 | E79: 335 | G79: 26.1 | H79: 26.1 | K79: of:=[.H79]/100+0.4*0.789*7.4 -> 2.59644 | M79: 1 bottle = 70cl | O79: of:=COM.MICROSOFT.IFS([.D79]>3;"";[.C79]="g";1;[.C79]="ml";1;1;"") -> 1
A80: Condensed milk, sweetened | C80: ml | D80: 1 | E80: 322 | F80: 8 | G80: 55 | H80: 55 | I80: 7.5 | J80: 0.25 | K80: of:=[.H80]/100 -> 0.55 | L80: 20 | O80: of:=COM.MICROSOFT.IFS([.D80]>3;"";[.C80]="g";1;[.C80]="ml";1;1;"") -> 1
A81: Condensed milk, sweetened (SCM) [Dovgan] | C81: ml | D81: 1 | E81: 325 | F81: 8 | G81: 56.4 | H81: 56.4 | I81: 6.9 | J81: 0.23 | K81: of:=[.H81]/100 -> 0.564 | L81: 20 | O81: of:=COM.MICROSOFT.IFS([.D81]>3;"";[.C81]="g";1;[.C81]="ml";1;1;"") -> 1
A82: Corn starch | C82: g | D82: 0 | E82: 353 | F82: 0.5 | G82: 86 | H82: 0.5 | I82: 0.5 | J82: 0.01 | O82: of:=COM.MICROSOFT.IFS([.D82]>3;"";[.C82]="g";1;[.C82]="ml";1;1;"") -> 1
A83: Cottage Cheese 4% (creamed, US/CA) | C83: g | D83: 1 | E83: 104 | F83: 4.3 | G83: 3.4 | H83: 2.7 | I83: 11 | J83: 0.36 | K83: of:=[.H83]/100 -> 0.027 | L83: of:=[.F83]/0.2-[.F83] -> 17.2 | O83: of:=COM.MICROSOFT.IFS([.D83]>3;"";[.C83]="g";1;[.C83]="ml";1;1;"") -> 1
A84: Cottage Cheese 4% [REWE Bio] | C84: g | D84: 1 | E84: 91 | F84: 4 | G84: 1 | H84: 1 | I84: 12.7 | J84: 0.69 | K84: of:=[.H84]/100 -> 0.01 | L84: of:=[.F84]/0.2-[.F84] -> 16 | O84: of:=COM.MICROSOFT.IFS([.D84]>3;"";[.C84]="g";1;[.C84]="ml";1;1;"") -> 1
A85: Cream 32% [REWE Beste Wahl] | C85: ml | D85: 3 | E85: 311 | F85: 32 | G85: 3.2 | H85: 3.2 | I85: 2.5 | J85: 0.13 | K85: of:=[.H85]/100 -> 0.032 | L85: of:=(100-[.F85])*0.093 -> 6.324 | O85: of:=COM.MICROSOFT.IFS([.D85]>3;"";[.C85]="g";1;[.C85]="ml";1;1;"") -> 1
A86: Cream 37% (heavy) | C86: ml | D86: 3 | E86: 353 | F86: 37 | G86: 2.9 | H86: 2.9 | I86: 2 | J86: 0.1 | K86: of:=[.H86]/100 -> 0.029 | L86: of:=(100-[.F86])*0.093 -> 5.859 | O86: of:=COM.MICROSOFT.IFS([.D86]>3;"";[.C86]="g";1;[.C86]="ml";1;1;"") -> 1
A87: Cream 48% (double cream) | C87: ml | D87: 3 | E87: 445 | F87: 48 | G87: 2.6 | H87: 2.6 | I87: 1.7 | J87: 0.1 | K87: of:=[.H87]/100 -> 0.026 | L87: of:=(100-[.F87])*0.093 -> 4.836 | O87: of:=COM.MICROSOFT.IFS([.D87]>3;"";[.C87]="g";1;[.C87]="ml";1;1;"") -> 1
A88: Cream Cheese 23% [Exquisa] | C88: g | D88: 1 | E88: 238 | F88: 22.5 | G88: 3 | H88: 3 | I88: 5.5 | J88: 0.7 | K88: of:=[.H88]/100 -> 0.03 | L88: of:=[.F88]/0.7-[.F88] -> 9.64285714285715 | M88: click the link for UK / US equivalents | O88: of:=COM.MICROSOFT.IFS([.D88]>3;"";[.C88]="g";1;[.C88]="ml";1;1;"") -> 1
A89: Crème double 42% | C89: ml | D89: 3 | E89: 398 | F89: 42 | G89: 3 | H89: 3 | I89: 2.2 | J89: 0.1 | K89: of:=[.H89]/100 -> 0.03 | L89: of:=(100-[.F89])*0.093 -> 5.394 | O89: of:=COM.MICROSOFT.IFS([.D89]>3;"";[.C89]="g";1;[.C89]="ml";1;1;"") -> 1
A90: Croissants (“Mini Butter”) [REWE/Ölz] | C90: g | D90: 4 | E90: 358 | F90: 11 | G90: 56 | H90: 13 | I90: 7.6 | J90: 1.1 | M90: 1pc = 25g
A91: Dark chocolate 70% (intensive) [Lindt] | C91: g | D91: 4 | E91: 566 | F91: 41 | G91: 35 | H91: 30 | I91: 9.5 | J91: 0.02 | K91: of:=[.H91]/100-0.009*[.F91] -> -0.069 | M91: Portion = 20g | O91: of:=COM.MICROSOFT.IFS([.D91]>3;"";[.C91]="g";1;[.C91]="ml";1;1;"") -> 
A92: Dark chocolate 70% (mild) [Lindt] | C92: g | D92: 4 | E92: 610 | F92: 48 | G92: 33 | H92: 29 | I92: 6.9 | J92: 0.01 | K92: of:=[.H92]/100-0.009*[.F92] -> -0.142 | M92: Portion = 20g | O92: of:=COM.MICROSOFT.IFS([.D92]>3;"";[.C92]="g";1;[.C92]="ml";1;1;"") -> 
A93: Dark chocolate 70% [Moser-Roth/Aldi] | C93: g | D93: 4 | E93: 578 | F93: 42 | G93: 34 | H93: 28 | I93: 9.5 | J93: 0.02 | K93: of:=[.H93]/100-0.009*[.F93] -> -0.0979999999999999 | M93: Portion = 25g | O93: of:=COM.MICROSOFT.IFS([.D93]>3;"";[.C93]="g";1;[.C93]="ml";1;1;"") -> 
A94: Dark chocolate 85% [Moser-Roth/Aldi] | C94: g | D94: 4 | E94: 604 | F94: 50 | G94: 20 | H94: 14 | I94: 11 | J94: 0.24 | K94: of:=[.H94]/100-0.009*[.F94] -> -0.31 | M94: Portion = 25g | O94: of:=COM.MICROSOFT.IFS([.D94]>3;"";[.C94]="g";1;[.C94]="ml";1;1;"") -> 
A95: Dark chocolate 90% [Moser-Roth/Aldi] | C95: g | D95: 4 | E95: 645 | F95: 57 | G95: 15 | H95: 8.8 | I95: 11 | J95: 0.02 | K95: of:=[.H95]/100-0.009*[.F95] -> -0.425 | M95: Portion = 25g | O95: of:=COM.MICROSOFT.IFS([.D95]>3;"";[.C95]="g";1;[.C95]="ml";1;1;"") -> 
A96: Designer Flavor Powder [ESN] | C96: g | D96: 2 | E96: 285 | F96: 5.6 | G96: 25 | H96: 19 | I96: 1.8 | J96: 0.11 | K96: of:=[.H96]/100 -> 0.19 | M96: ≈70% inulin | N96: 6 | O96: of:=COM.MICROSOFT.IFS([.D96]>3;"";[.C96]="g";1;[.C96]="ml";1;1;"") -> 1
A97: Dextrose | C97: g | D97: 2 | E97: 350 | G97: 100 | H97: 100 | K97: 1.9 | M97: POD 70% | O97: of:=COM.MICROSOFT.IFS([.D97]>3;"";[.C97]="g";1;[.C97]="ml";1;1;"") -> 1
A98: Dinke flour 630 (organic) [REWE Bio] | C98: g | D98: 2 | E98: 344 | F98: 1.3 | G98: 69 | H98: 0.6 | I98: 12 | M98: or any cake flour | O98: of:=COM.MICROSOFT.IFS([.D98]>3;"";[.C98]="g";1;[.C98]="ml";1;1;"") -> 1
A99: Dragon Fruit (freeze dried) [Zingy Zoo] | C99: g | D99: 2 | E99: 393 | F99: 5.3 | G99: 78.6 | H99: 53.6 | I99: 7.1 | J99: 0 | K99: of:=[.H99]/100 -> 0.536 | M99: for color | O99: of:=COM.MICROSOFT.IFS([.D99]>3;"";[.C99]="g";1;[.C99]="ml";1;1;"") -> 1
A100: Egg Cream Punch 9 vol% [Katlenburger] | C100: ml | D100: 1 | E100: 84 | F100: 1.6 | G100: 4.5 | H100: 3 | I100: 0.8 | K100: of:=[.H100]/100+0.09*0.789*7.4 -> 0.555474 | M100: 1 bottle = 750ml | O100: of:=COM.MICROSOFT.IFS([.D100]>3;"";[.C100]="g";1;[.C100]="ml";1;1;"") -> 1
A101: Egg Liqueur 15 vol% [Bols Advocaat] | C101: ml | D101: 1 | E101: 85 | F101: 6.8 | G101: 27 | H101: 27 | I101: 1 | J101: 0 | K101: of:=[.H101]/100+0.15*0.789*7.4 -> 1.14579 | M101: 1 bottle = 700ml | O101: of:=COM.MICROSOFT.IFS([.D101]>3;"";[.C101]="g";1;[.C101]="ml";1;1;"") -> 1
A102: Egg whites | C102: g | D102: 1 | E102: 131 | F102: 9 | I102: 12.6 | J102: 0.39 | O102: of:=COM.MICROSOFT.IFS([.D102]>3;"";[.C102]="g";1;[.C102]="ml";1;1;"") -> 1
A103: Egg yolk (liquid) | C103: g | D103: 1 | E103: 321 | F103: 27 | G103: 4 | H103: 1 | I103: 16 | J103: 0.01 | M103: 1 yolk ~17g | O103: of:=COM.MICROSOFT.IFS([.D103]>3;"";[.C103]="g";1;[.C103]="ml";1;1;"") -> 1
A104: Eggs | C104: g | D104: 1 | E104: 153 | F104: 11 | G104: 0.6 | H104: 0.4 | I104: 13 | J104: 0.32 | M104: 1 medium egg 55–60g | O104: of:=COM.MICROSOFT.IFS([.D104]>3;"";[.C104]="g";1;[.C104]="ml";1;1;"") -> 1
A105: Erythritol (E968) | C105: g | D105: 2 | E105: 24 | F105: 0 | G105: 100 | H105: 0 | I105: 0 | J105: 0 | K105: 2.8 | M105: POD = 75% | N105: 100 | O105: of:=COM.MICROSOFT.IFS([.D105]>3;"";[.C105]="g";1;[.C105]="ml";1;1;"") -> 1
A106: Ethanol 97.5% | C106: g | D106: 1 | E106: 682 | K106: of:=7.4*0.78945*0.975 -> 5.69588175 | O106: of:=COM.MICROSOFT.IFS([.D106]>3;"";[.C106]="g";1;[.C106]="ml";1;1;"") -> 1
A107: Evaporated milk 10% [Milsani/Aldi] | C107: ml | D107: 1 | E107: 175 | F107: 10 | G107: 13 | H107: 13 | I107: 7.9 | J107: 0.43 | K107: of:=[.H107]/100 -> 0.13 | L107: of:=(100-[.F107])*0.093*2.55 -> 21.3435 | M107: Tetrapack 340g | O107: of:=COM.MICROSOFT.IFS([.D107]>3;"";[.C107]="g";1;[.C107]="ml";1;1;"") -> 1
A108: Evaporated milk 7.5% [Pilos/Lidl] | C108: ml | D108: 1 | E108: 132 | F108: 7.5 | G108: 10.2 | H108: 10.2 | I108: 7.6 | J108: 0.28 | K108: of:=[.H108]/100 -> 0.102 | L108: of:=(100-[.F108])*0.093*2 -> 17.205 | M108: Tetrapack 340g | O108: of:=COM.MICROSOFT.IFS([.D108]>3;"";[.C108]="g";1;[.C108]="ml";1;1;"") -> 1
A109: Fir honey [Bihophar] | C109: g | D109: 1 | E109: 338 | G109: 84 | H109: 58 | I109: 0.1 | J109: 0.19 | K109: 1.46 | O109: of:=COM.MICROSOFT.IFS([.D109]>3;"";[.C109]="g";1;[.C109]="ml";1;1;"") -> 1
A110: Flavor drops “Natural” (stevia) [Nick’s] | C110: drops | D110: 1 | M110: to taste • unflavored | O110: of:=COM.MICROSOFT.IFS([.D110]>3;"";[.C110]="g";1;[.C110]="ml";1;1;"") -> 
A111: Flavor drops Caramel (sucralose) [IronMaxx] | C111: drops | D111: 1 | M111: to taste | O111: of:=COM.MICROSOFT.IFS([.D111]>3;"";[.C111]="g";1;[.C111]="ml";1;1;"") -> 
A112: Flavor drops Cookies&Cream (stevia) [Nick’s] | C112: drops | D112: 1 | M112: to taste | O112: of:=COM.MICROSOFT.IFS([.D112]>3;"";[.C112]="g";1;[.C112]="ml";1;1;"") -> 
A113: Flavor drops Peach / Maracuja (sucralose) [IronMaxx] | C113: drops | D113: 1 | M113: to taste | O113: of:=COM.MICROSOFT.IFS([.D113]>3;"";[.C113]="g";1;[.C113]="ml";1;1;"") -> 
A114: Flavor drops Strawberry (sucralose) [IronMaxx] | C114: drops | D114: 1 | M114: to taste | O114: of:=COM.MICROSOFT.IFS([.D114]>3;"";[.C114]="g";1;[.C114]="ml";1;1;"") -> 
A115: Flavor drops Vanilla (sucralose) [IronMaxx] | C115: drops | D115: 1 | M115: to taste | O115: of:=COM.MICROSOFT.IFS([.D115]>3;"";[.C115]="g";1;[.C115]="ml";1;1;"") -> 
A116: Fruit spead 75% “Plum” [dm/Allos] | C116: g | D116: 5 | E116: 123 | F116: 0.5 | G116: 29 | H116: 27 | I116: 0.5 | J116: 0.06 | M116: of:=COM.MICROSOFT.CONCAT("spread with 75% fruit; add as a mix-in or topping [";ROUND([.E116]*[.B116]/100); "kcal, ";ROUND([.H116]*[.B116]/100;1); "g sugar]") -> spread with 75% fruit; add as a mix-in or topping [0kcal, 0g sugar]
A117: Früli Belgian Strawberry Beer 4.1 vol% (0.33l) | C117: ml | D117: 1 | E117: 50 | G117: 6.6 | H117: 6 | K117: of:=[.H117]/100+0.041*0.789*7.4 -> 0.2993826 | O117: of:=COM.MICROSOFT.IFS([.D117]>3;"";[.C117]="g";1;[.C117]="ml";1;1;"") -> 1
A118: Full Fat Milkpowder [Mr. Brown] | C118: g | D118: 2 | E118: 482 | F118: 26 | G118: 35 | H118: 35 | I118: 25 | J118: 0.94 | K118: of:=[.H118]/100 -> 0.35 | L118: of:=95-[.F118] -> 69 | O118: of:=COM.MICROSOFT.IFS([.D118]>3;"";[.C118]="g";1;[.C118]="ml";1;1;"") -> 1
A119: Galia melon (organic) | C119: g | D119: 1 | E119: 26 | F119: 0.1 | G119: 5.6 | H119: 5.6 | I119: 0.5 | J119: 0.08 | K119: of:=[.H119]/100 -> 0.056 | M119: 1 melon = 1.3kg, 60–70% yield | O119: of:=COM.MICROSOFT.IFS([.D119]>3;"";[.C119]="g";1;[.C119]="ml";1;1;"") -> 1
A120: Gelatin powder | C120: g | D120: 2 | E120: 357 | I120: 84.4 | J120: 0.04 | O120: of:=COM.MICROSOFT.IFS([.D120]>3;"";[.C120]="g";1;[.C120]="ml";1;1;"") -> 1
A121: Gin 40 vol% (Spanish) [Larios] | C121: g | D121: 1 | E121: 221 | K121: of:=7.4*0.4 -> 2.96 | M121: Bottle = 70cl | O121: of:=COM.MICROSOFT.IFS([.D121]>3;"";[.C121]="g";1;[.C121]="ml";1;1;"") -> 1
A122: Glycerin (E422, VG) [hd-line] | C122: g | D122: 1 | E122: 400 | G122: 99 | K122: 3.7 | M122: POD = 60%; GI = 5; Density = 1.26 g/ml | N122: 50 | O122: of:=COM.MICROSOFT.IFS([.D122]>3;"";[.C122]="g";1;[.C122]="ml";1;1;"") -> 1
A123: Glycerol Monostearate (E471) [Bulk] | C123: g | D123: 2 | E123: 415 | M123: *alternative:* lecithin | O123: of:=COM.MICROSOFT.IFS([.D123]>3;"";[.C123]="g";1;[.C123]="ml";1;1;"") -> 1
A124: Goji berries dried [Happy Belly] | C124: g | D124: 4 | E124: 395 | F124: 0.4 | G124: 77.1 | H124: 45.6 | I124: 14.3 | J124: 0.75 | M124: Mix-in for a full tub (2 servings) | O124: of:=COM.MICROSOFT.IFS([.D124]>3;"";[.C124]="g";1;[.C124]="ml";1;1;"") -> 
A125: Grape Juice | C125: ml | D125: 1 | E125: 64 | G125: 15.9 | H125: 15.5 | I125: 0.15 | J125: 0.07 | K125: of:=[.H125]/100 -> 0.155 | O125: of:=COM.MICROSOFT.IFS([.D125]>3;"";[.C125]="g";1;[.C125]="ml";1;1;"") -> 1
A126: Greek Yogurt 9% [Lyttos] | C126: g | D126: 1 | E126: 113 | F126: 9.2 | G126: 3.8 | H126: 3.8 | I126: 3.2 | J126: 0.13 | K126: of:=[.H126]/100 -> 0.038 | L126: of:=([.G126]+[.I126]+[.J126])*1.11 -> 7.9143 | O126: of:=COM.MICROSOFT.IFS([.D126]>3;"";[.C126]="g";1;[.C126]="ml";1;1;"") -> 1
A127: Greek Yogurt Vanilla 0% [Dannon Light+Fit] | C127: g | D127: 1 | E127: 54 | F127: 0 | G127: 6 | H127: 4.7 | I127: 8 | J127: 0.03 | K127: of:=[.H127]/100 -> 0.047 | L127: of:=([.G127]+[.I127]+[.J127])*1.11 -> 15.5733 | O127: of:=COM.MICROSOFT.IFS([.D127]>3;"";[.C127]="g";1;[.C127]="ml";1;1;"") -> 1
A128: Guar gum (E412) | C128: g | D128: 2 | E128: 180 | F128: 0.6 | G128: 84 | H128: 0 | I128: 5.5 | J128: 0.3 | O128: of:=COM.MICROSOFT.IFS([.D128]>3;"";[.C128]="g";1;[.C128]="ml";1;1;"") -> 1
A129: Guava paste (Goiabada Poli) [Predilecta] | C129: g | D129: 1 | E129: 344 | F129: 0 | G129: 86 | H129: 69 | I129: 0 | J129: 0.01 | K129: of:=[.H129]/100 -> 0.69 | O129: of:=COM.MICROSOFT.IFS([.D129]>3;"";[.C129]="g";1;[.C129]="ml";1;1;"") -> 1
A130: Gum Arabic (Acacia, E414) [SaporePuro] | C130: g | D130: 2 | E130: 180 | F130: 0 | G130: 0 | H130: 0 | I130: 2.5 | J130: 0.9 | M130: 85% fiber | O130: of:=COM.MICROSOFT.IFS([.D130]>3;"";[.C130]="g";1;[.C130]="ml";1;1;"") -> 1
A131: Hazelnut Flavor Powder [He Ju] | C131: g | D131: 2 | E131: 249 | F131: 3.3 | G131: 17 | H131: 11.5 | I131: 3.4 | J131: 0.16 | K131: of:=[.H131]/100 -> 0.115 | O131: of:=COM.MICROSOFT.IFS([.D131]>3;"";[.C131]="g";1;[.C131]="ml";1;1;"") -> 1
A132: Hemp hearts (organic, shelled) [alnatura] | C132: g | D132: 2 | E132: 630 | F132: 52 | G132: 5.4 | H132: 1.8 | I132: 32 | J132: 0.02 | O132: of:=COM.MICROSOFT.IFS([.D132]>3;"";[.C132]="g";1;[.C132]="ml";1;1;"") -> 1
A133: Hemp hearts (organic, shelled) [Sevenhills] | C133: g | D133: 2 | E133: 610 | F133: 51.2 | G133: 5.3 | H133: 2.2 | I133: 31 | J133: 0.01 | O133: of:=COM.MICROSOFT.IFS([.D133]>3;"";[.C133]="g";1;[.C133]="ml";1;1;"") -> 1
A134: Hemp protein powder (organic) [Sevenhills] | C134: g | D134: 2 | E134: 349 | F134: 9 | G134: 7.4 | H134: 4.9 | I134: 48.3 | J134: 0.1 | K134: of:=[.H134]/100 -> 0.049 | M134: 48% protein, 23% fiber, 9% fat, 5% sugar | O134: of:=COM.MICROSOFT.IFS([.D134]>3;"";[.C134]="g";1;[.C134]="ml";1;1;"") -> 1
A135: Hokkaido pumpkin (organic) [REWE] | C135: g | D135: 1 | E135: 28 | F135: 0 | G135: 4.6 | H135: 3.9 | I135: 1.1 | J135: 0.01 | K135: of:=[.H135]/100 -> 0.039 | M135: 450g frozen | O135: of:=COM.MICROSOFT.IFS([.D135]>3;"";[.C135]="g";1;[.C135]="ml";1;1;"") -> 1
A136: Hokkaido pumpkin puree (organic) [REWE] | C136: g | D136: 1 | E136: 63 | F136: 0.3 | G136: 10.9 | H136: 4.9 | I136: 1.9 | J136: 0.1 | K136: of:=[.H136]/100 -> 0.049 | M136: 425g can | O136: of:=COM.MICROSOFT.IFS([.D136]>3;"";[.C136]="g";1;[.C136]="ml";1;1;"") -> 1
A137: Hon mirin 14 vol% [Fiico] | C137: g | D137: 1 | E137: 275 | G137: 49 | H137: 40 | I137: 0.5 | J137: 0.5 | K137: 0.82 | O137: of:=COM.MICROSOFT.IFS([.D137]>3;"";[.C137]="g";1;[.C137]="ml";1;1;"") -> 1
A138: Honey | C138: g | D138: 1 | E138: 286 | F138: 0 | G138: 81 | H138: 76.2 | K138: 1.56 | O138: of:=COM.MICROSOFT.IFS([.D138]>3;"";[.C138]="g";1;[.C138]="ml";1;1;"") -> 1
A139: ICS [Erythritol / CMC / Tara / XG] | C139: g | D139: 2 | E139: 23 | G139: 93.6 | I139: 0.1 | J139: 3.3 | K139: 2.33 | O139: of:=COM.MICROSOFT.IFS([.D139]>3;"";[.C139]="g";1;[.C139]="ml";1;1;"") -> 1
A140: ICSv2 [Erythritol / Inulin / CMC / Guar / XG / Salt] | C140: g | D140: 2 | E140: 107.247706422018 | F140: 0.00963302752293578 | G140: 95.5137614678899 | H140: 3.6697247706422 | I140: 0.115825688073395 | J140: 1.70665137614679 | K140: 1.31972041284404 | M140: http://bit.ly/4frc4Vj | N140: 90.8 | O140: of:=COM.MICROSOFT.IFS([.D140]>3;"";[.C140]="g";1;[.C140]="ml";1;1;"") -> 1
A141: Instant Coffee [Mount Hagen] | C141: g | D141: 2 | E141: 0 | M141: 1.5g per 125ml | O141: of:=COM.MICROSOFT.IFS([.D141]>3;"";[.C141]="g";1;[.C141]="ml";1;1;"") -> 1
A142: Instant Drink “Woodruff” (0 sugar) [Instick] | C142: g | D142: 2 | E142: 383 | F142: 0 | G142: 96 | H142: 7.7 | I142: 0 | J142: 0.02 | K142: 1.29 | M142: 1 stick (2.5g) for 500ml water | O142: of:=COM.MICROSOFT.IFS([.D142]>3;"";[.C142]="g";1;[.C142]="ml";1;1;"") -> 1
A143: Instant Espresso (organic) [Mount Hagen] | C143: g | D143: 2 | E143: 0 | M143: 2.5g per 60ml • 1 jar = 50g | O143: of:=COM.MICROSOFT.IFS([.D143]>3;"";[.C143]="g";1;[.C143]="ml";1;1;"") -> 1
A144: Inulin [Vit4ever] | C144: g | D144: 2 | E144: 210 | G144: 97 | H144: 8 | J144: 0.2 | K144: 0.09 | M144: Sweetness = 8%; GI ~= 0 | N144: 89 | O144: of:=COM.MICROSOFT.IFS([.D144]>3;"";[.C144]="g";1;[.C144]="ml";1;1;"") -> 1
A145: Inulin HP [Saporepuro] | C145: g | D145: 2 | E145: 194 | G145: 0.5 | H145: 0.5 | K145: 0.1 | O145: of:=COM.MICROSOFT.IFS([.D145]>3;"";[.C145]="g";1;[.C145]="ml";1;1;"") -> 1
A146: Irish Cream 17 vol% [Baileys] | C146: ml | D146: 1 | E146: 314 | F146: 13.6 | G146: 21.7 | H146: 18 | I146: 2.8 | J146: 0 | K146: of:=[.H146]/100+0.17*0.789*7.4 -> 1.172562 | M146: 1 bottle = 700ml | O146: of:=COM.MICROSOFT.IFS([.D146]>3;"";[.C146]="g";1;[.C146]="ml";1;1;"") -> 1
A147: Isomalt (E953) [GoodBake] | C147: g | D147: 2 | E147: 236 | G147: 98 | K147: 0.39 | M147: Very low GI, 50% sweetness | N147: 50 | O147: of:=COM.MICROSOFT.IFS([.D147]>3;"";[.C147]="g";1;[.C147]="ml";1;1;"") -> 1
A148: Jamaica Rum 43 vol% | C148: g | D148: 1 | E148: 300 | K148: of:=7.4*0.43 -> 3.182 | O148: of:=COM.MICROSOFT.IFS([.D148]>3;"";[.C148]="g";1;[.C148]="ml";1;1;"") -> 1
A149: Kefir mild 1.5% [Milsani / Aldi] | C149: g | D149: 1 | E149: 47 | F149: 1.5 | G149: 4.1 | H149: 4.1 | I149: 3.2 | J149: 0.12 | K149: of:=[.H149]/100 -> 0.041 | L149: of:=100-91-[.F149] -> 7.5 | M149: 500g container | O149: of:=COM.MICROSOFT.IFS([.D149]>3;"";[.C149]="g";1;[.C149]="ml";1;1;"") -> 1
A150: Kiwi | C150: g | D150: 6 | E150: 52 | F150: 0.7 | G150: 8.8 | H150: 8.6 | I150: 0.9 | J150: 0 | K150: of:=[.H150]/100 -> 0.086 | M150: of:=COM.MICROSOFT.CONCAT("fresh [";ROUND([.E150]*[.B150]/100); "kcal, ";ROUND([.H150]*[.B150]/100); "g sugar]") -> fresh [0kcal, 0g sugar] | O150: of:=COM.MICROSOFT.IFS([.D150]>3;"";[.C150]="g";1;[.C150]="ml";1;1;"") -> 
A151: Konjac (E425, 97% glucomannan) [Vita2You] | C151: g | D151: 0 | E151: 10 | G151: 97 | H151: 0 | O151: of:=COM.MICROSOFT.IFS([.D151]>3;"";[.C151]="g";1;[.C151]="ml";1;1;"") -> 1
A152: Lactose [Sunlife] | C152: g | D152: 2 | E152: 380 | F152: 0 | G152: 95 | H152: 95 | I152: 0.1 | J152: 0 | K152: of:=[.H152]/100 -> 0.95 | L152: 95 | O152: of:=COM.MICROSOFT.IFS([.D152]>3;"";[.C152]="g";1;[.C152]="ml";1;1;"") -> 1
A153: Le Sirop de Monin “Falernum” | C153: ml | D153: 1 | E153: 315 | G153: 78.3 | H153: 78.2 | J153: 0.03 | K153: of:=[.H153]/100 -> 0.782 | M153: 1 bottle = 70cl | O153: of:=COM.MICROSOFT.IFS([.D153]>3;"";[.C153]="g";1;[.C153]="ml";1;1;"") -> 1
A154: Lecithin (Soy) [My Lecithin] | C154: g | D154: 2 | E154: 760 | F154: 91 | G154: 9 | H154: 5 | I154: 0.3 | J154: 0.05 | O154: of:=COM.MICROSOFT.IFS([.D154]>3;"";[.C154]="g";1;[.C154]="ml";1;1;"") -> 1
A155: Lemon juice | C155: ml | D155: 1 | E155: 25 | F155: 0.1 | G155: 3.36 | H155: 1.65 | I155: 0.3 | J155: 0.01 | K155: of:=[.H155]/100 -> 0.0165 | O155: of:=COM.MICROSOFT.IFS([.D155]>3;"";[.C155]="g";1;[.C155]="ml";1;1;"") -> 1
A156: Light corn syrup (32 DE) [Karo] | C156: ml | D156: 1 | E156: 400 | G156: 100 | H156: 33 | J156: 0.25 | K156: 0.61 | M156: US brand | O156: of:=COM.MICROSOFT.IFS([.D156]>3;"";[.C156]="g";1;[.C156]="ml";1;1;"") -> 1
A157: Lime juice + zest (organic) [REWE Bio] | C157: ml | D157: 1 | E157: 25 | F157: 0.1 | G157: 8.4 | H157: 1.7 | I157: 0.4 | M157: 1 lime = 60..65g | O157: of:=COM.MICROSOFT.IFS([.D157]>3;"";[.C157]="g";1;[.C157]="ml";1;1;"") -> 1
A158: Limoncello di Calabria 28 vol% [REWE] | C158: ml | D158: 1 | E158: 261 | F158: 0 | G158: 26.6 | H158: 26.6 | I158: 0 | K158: of:=[.H158]/100+0.28*0.789*7.4 -> 1.900808 | M158: 1 bottle = 700ml | O158: of:=COM.MICROSOFT.IFS([.D158]>3;"";[.C158]="g";1;[.C158]="ml";1;1;"") -> 1
A159: Limoncello RAVINI Crema 17 vol% 500ml [Aldi] | C159: ml | D159: 1 | E159: 99 | F159: 7 | G159: 25 | H159: 25 | I159: 1 | J159: 0 | K159: of:=[.H159]/100+0.17*0.789*7.4 -> 1.242562 | O159: of:=COM.MICROSOFT.IFS([.D159]>3;"";[.C159]="g";1;[.C159]="ml";1;1;"") -> 1
A160: Lingonberry powder [Bio Leis] | C160: g | D160: 2 | E160: 351 | F160: 2.3 | G160: 78.8 | H160: 72.5 | I160: 3.7 | J160: 0.01 | K160: of:=[.H160]/100 -> 0.725 | O160: of:=COM.MICROSOFT.IFS([.D160]>3;"";[.C160]="g";1;[.C160]="ml";1;1;"") -> 1
A161: Maltodextrin (18 DE) | C161: g | D161: 2 | E161: 383 | F161: 0 | G161: 96 | H161: 7.7 | I161: 0 | J161: 0.02 | K161: 1.29 | M161: POD 15%; GI ~= 120 | O161: of:=COM.MICROSOFT.IFS([.D161]>3;"";[.C161]="g";1;[.C161]="ml";1;1;"") -> 1
A162: Mandarins in juice [REWE] | C162: g | D162: 1 | E162: 48 | F162: 0 | G162: 11 | H162: 9 | I162: 0.6 | J162: 0.02 | K162: of:=[.H162]/100 -> 0.09 | O162: of:=COM.MICROSOFT.IFS([.D162]>3;"";[.C162]="g";1;[.C162]="ml";1;1;"") -> 1
A163: Mango | C163: g | D163: 1 | E163: 62 | F163: 0.5 | G163: 13 | H163: 13 | I163: 0.6 | J163: 0 | K163: of:=[.H163]/100 -> 0.13 | O163: of:=COM.MICROSOFT.IFS([.D163]>3;"";[.C163]="g";1;[.C163]="ml";1;1;"") -> 1
A164: Mascarpone 42% [Galbani] | C164: g | D164: 1 | E164: 412 | F164: 41.5 | G164: 4.8 | H164: 4.5 | I164: 4.8 | J164: 0.08 | L164: of:=[.F164]/0.8*0.2 -> 10.375 | O164: of:=COM.MICROSOFT.IFS([.D164]>3;"";[.C164]="g";1;[.C164]="ml";1;1;"") -> 1
A165: Matcha green tea powder (organic) [Mandoi] | C165: g | D165: 0 | E165: 383 | F165: 3.9 | G165: 65.4 | I165: 29.3 | J165: 0.01 | M165: 1tbsp = 6g; 1tsp = 2g | O165: of:=COM.MICROSOFT.IFS([.D165]>3;"";[.C165]="g";1;[.C165]="ml";1;1;"") -> 1
A166: Medjool dates (organic) [Seba Garden] | C166: g | D166: 1 | E166: 277 | F166: 0.2 | G166: 75 | H166: 66 | I166: 1.8 | J166: 0.01 | K166: of:=[.H166]/100 -> 0.66 | M166: 1 date = 20g; distinctive caramel taste with hints of vanilla | O166: of:=COM.MICROSOFT.IFS([.D166]>3;"";[.C166]="g";1;[.C166]="ml";1;1;"") -> 1
A167: Milk 3.5% [Weihenstephan] | C167: ml | D167: 1 | E167: 64 | F167: 3.5 | G167: 4.7 | H167: 4.7 | I167: 3.5 | J167: 0.13 | K167: of:=[.H167]/100 -> 0.047 | L167: of:=(100-[.F167])*0.093 -> 8.9745 | O167: of:=COM.MICROSOFT.IFS([.D167]>3;"";[.C167]="g";1;[.C167]="ml";1;1;"") -> 1
A168: Milk Chocolate 33% (organic) [Alnatura] | C168: g | D168: 1 | E168: 579 | F168: 39 | G168: 49 | H168: 48 | I168: 7 | J168: 0.24 | K168: of:=[.H168]/100 -> 0.48 | O168: of:=COM.MICROSOFT.IFS([.D168]>3;"";[.C168]="g";1;[.C168]="ml";1;1;"") -> 1
A169: Mint chocolate thins [After Eight] | C169: g | D169: 4 | E169: 426 | F169: 12.9 | G169: 73.5 | H169: 67.8 | I169: 2.1 | J169: 0.03 | M169: of:=COM.MICROSOFT.CONCAT("1pc ≈ 7.5g; freeze for more integrity [";ROUND([.E169]*[.B169]/100); "kcal, ";ROUND([.H169]*[.B169]/100); "g sugar]") -> 1pc ≈ 7.5g; freeze for more integrity [0kcal, 0g sugar]
A170: Miso “Genmai” (organic, vegan) [Fairment] | C170: g | D170: 1 | E170: 196 | F170: 7.2 | G170: 17.8 | H170: 10.5 | I170: 10.8 | J170: 11.5 | K170: of:=[.H170]/100 -> 0.105 | M170: 200g jar | O170: of:=COM.MICROSOFT.IFS([.D170]>3;"";[.C170]="g";1;[.C170]="ml";1;1;"") -> 1
A171: Molasses [Grafschafter Goldsaft] | C171: g | D171: 1 | E171: 306 | F171: 0.5 | G171: 70 | H171: 66 | I171: 2.3 | J171: 0.03 | K171: 0.66 | M171: Sweetness = 66% | O171: of:=COM.MICROSOFT.IFS([.D171]>3;"";[.C171]="g";1;[.C171]="ml";1;1;"") -> 1
A172: Monk fruit sweetener | C172: g | D172: 2 | K172: 0.1 | M172: FPDF is guesstimated | O172: of:=COM.MICROSOFT.IFS([.D172]>3;"";[.C172]="g";1;[.C172]="ml";1;1;"") -> 1
A173: Nutella | C173: g | D173: 1 | E173: 539 | F173: 30.9 | G173: 57.5 | H173: 56.3 | I173: 6.3 | J173: 0.11 | K173: of:=[.H173]/100 -> 0.563 | O173: of:=COM.MICROSOFT.IFS([.D173]>3;"";[.C173]="g";1;[.C173]="ml";1;1;"") -> 1
A174: Nutmeg | C174: g | D174: 2 | M174: to taste; 1tsp ≈ 3g | O174: of:=COM.MICROSOFT.IFS([.D174]>3;"";[.C174]="g";1;[.C174]="ml";1;1;"") -> 1
A175: Oat milk 3% [Oatly Barista] | C175: ml | D175: 1 | E175: 61 | F175: 3 | G175: 7.1 | H175: 3.4 | I175: 1.1 | J175: 0.1 | K175: of:=[.H175]/100 -> 0.034 | L175: 8 | O175: of:=COM.MICROSOFT.IFS([.D175]>3;"";[.C175]="g";1;[.C175]="ml";1;1;"") -> 1
A176: Orange juice (freshly pressed) | C176: ml | D176: 1 | E176: 45 | F176: 0.2 | G176: 10.4 | H176: 8.4 | I176: 0.7 | J176: 0 | K176: of:=[.H176]/100 -> 0.084 | O176: of:=COM.MICROSOFT.IFS([.D176]>3;"";[.C176]="g";1;[.C176]="ml";1;1;"") -> 1
A177: Orange juice (with pulp) [Aldi] | C177: ml | D177: 1 | E177: 43 | F177: 0.5 | G177: 8.8 | H177: 8.8 | I177: 0.7 | J177: 0.01 | K177: of:=[.H177]/100 -> 0.088 | O177: of:=COM.MICROSOFT.IFS([.D177]>3;"";[.C177]="g";1;[.C177]="ml";1;1;"") -> 1
A178: Paella Rice (Bomba) [Santo Tomas] | C178: g | D178: 0 | E178: 344 | F178: 0.68 | G178: 76.9 | H178: 0.21 | I178: 7 | J178: 0.01 | M178: Or short grain milk rice | O178: of:=COM.MICROSOFT.IFS([.D178]>3;"";[.C178]="g";1;[.C178]="ml";1;1;"") -> 1
A179: Pandan Leaves Extract 80% [Nang Fah] | C179: ml | D179: 1 | E179: 4 | F179: 0.2 | G179: 0.2 | H179: 0 | I179: 0.3 | J179: 0 | M179: 1 can = 400ml | O179: of:=COM.MICROSOFT.IFS([.D179]>3;"";[.C179]="g";1;[.C179]="ml";1;1;"") -> 1
A180: PB powder [Fitmeals] | C180: g | D180: 2 | E180: 387 | F180: 14 | G180: 30 | H180: 6 | I180: 50 | J180: 0 | K180: of:=[.H180]/100 -> 0.06 | O180: of:=COM.MICROSOFT.IFS([.D180]>3;"";[.C180]="g";1;[.C180]="ml";1;1;"") -> 1
A181: PB powder [Vilgain] | C181: g | D181: 2 | E181: 387 | F181: 14 | G181: 17 | H181: 9 | I181: 48 | J181: 0.02 | K181: of:=[.H181]/100 -> 0.09 | O181: of:=COM.MICROSOFT.IFS([.D181]>3;"";[.C181]="g";1;[.C181]="ml";1;1;"") -> 1
A182: Peaches in Grape Juice [Libby’s] | C182: g | D182: 1 | E182: 53 | G182: 12 | H182: 9 | I182: 0.5 | M182: Can = 410g | O182: of:=COM.MICROSOFT.IFS([.D182]>3;"";[.C182]="g";1;[.C182]="ml";1;1;"") -> 1
A183: Peanut butter (creamy, organic) [REWE] | C183: g | D183: 0 | E183: 604 | F183: 51.1 | G183: 7.3 | H183: 4.5 | I183: 24.7 | J183: 0.43 | M183: 250g glass jar | O183: of:=COM.MICROSOFT.IFS([.D183]>3;"";[.C183]="g";1;[.C183]="ml";1;1;"") -> 1
A184: Peanut butter (crunchy, organic) [REWE] | C184: g | D184: 0 | E184: 604 | F184: 51 | G184: 7.3 | H184: 4.5 | I184: 25 | J184: 0.43 | M184: 250g glass jar | O184: of:=COM.MICROSOFT.IFS([.D184]>3;"";[.C184]="g";1;[.C184]="ml";1;1;"") -> 1
A185: Pear Juice | C185: ml | D185: 1 | E185: 47 | G185: 11 | H185: 10.5 | K185: of:=[.H185]/100 -> 0.105 | O185: of:=COM.MICROSOFT.IFS([.D185]>3;"";[.C185]="g";1;[.C185]="ml";1;1;"") -> 1
A186: Pecan nuts (organic) [Biojoy] | C186: g | D186: 5 | E186: 721 | F186: 72 | G186: 4.3 | H186: 4 | I186: 9.2 | J186: 0 | K186: of:=[.H186]/100 -> 0.04 | M186: of:=COM.MICROSOFT.CONCAT("10 halves = 15g; add as a topping [";ROUND([.E186]*[.B186]/100); "kcal, ";ROUND([.H186]*[.B186]/100;1); "g sugar]") -> 10 halves = 15g; add as a topping [0kcal, 0g sugar]
A187: Philadelphia Milka | C187: g | D187: 1 | E187: 286 | F187: 13 | G187: 34 | H187: 33 | I187: 6.4 | J187: 0.48 | K187: of:=[.H187]/100 -> 0.33 | O187: of:=COM.MICROSOFT.IFS([.D187]>3;"";[.C187]="g";1;[.C187]="ml";1;1;"") -> 1
A188: Pineapple in juice [Del Monte] | C188: g | D188: 1 | E188: 68 | G188: 15 | H188: 15 | I188: 0.4 | J188: 0.02 | K188: of:=[.H188]/100 -> 0.15 | M188: Can = 565g | O188: of:=COM.MICROSOFT.IFS([.D188]>3;"";[.C188]="g";1;[.C188]="ml";1;1;"") -> 1
A189: Pineapple in juice [REWE] | C189: g | D189: 1 | E189: 69 | G189: 16 | H189: 15 | I189: 0.6 | J189: 0 | K189: of:=[.H189]/100 -> 0.15 | M189: Can = 227g (140g fruit) | O189: of:=COM.MICROSOFT.IFS([.D189]>3;"";[.C189]="g";1;[.C189]="ml";1;1;"") -> 1
A190: Pistachio butter [Limfood] | C190: g | D190: 1 | E190: 621 | F190: 47 | G190: 29.3 | H190: 4.92 | I190: 15.2 | J190: 0 | K190: of:=[.H190]/100-0.009*[.F190] -> -0.3738 | M190: 90g container | O190: of:=COM.MICROSOFT.IFS([.D190]>3;"";[.C190]="g";1;[.C190]="ml";1;1;"") -> 1
A191: Pistachio butter [Pi-NUTS] | C191: g | D191: 1 | E191: 586 | F191: 46 | G191: 17 | H191: 7.8 | I191: 21 | J191: 0 | K191: of:=[.H191]/100-0.009*[.F191] -> -0.336 | M191: 250g container | O191: of:=COM.MICROSOFT.IFS([.D191]>3;"";[.C191]="g";1;[.C191]="ml";1;1;"") -> 1
A192: Pomegranate syrup (nar ekşisi) [fersan] | C192: g | D192: 1 | E192: 292 | F192: 0.1 | G192: 71.7 | H192: 53.4 | I192: 1 | J192: 0.6 | K192: of:=[.H192]/100 -> 0.534 | M192: 0.76 ml/g | O192: of:=COM.MICROSOFT.IFS([.D192]>3;"";[.C192]="g";1;[.C192]="ml";1;1;"") -> 1
A193: Protein 59% (vegan, organic, natural) [Nature Love] | C193: g | D193: 2 | E193: 375 | F193: 10 | G193: 3.9 | H193: 1.9 | I193: 59 | J193: 0.36 | L193: 78 | M193: Blend of ⅔ pumpkin and ⅓ sunflower seed | O193: 1
A194: Protein 79% (vegan, organic, natural) [Volksshake] | C194: g | D194: 2 | E194: 391 | F194: 6.4 | G194: 7 | H194: 0.2 | I194: 79 | J194: 0.9 | L194: 89 | M194: Blend of organic pea, rice, hemp, chia, sunflower & pumpkin seed (with guar gum) | O194: of:=COM.MICROSOFT.IFS([.D194]>3;"";[.C194]="g";1;[.C194]="ml";1;1;"") -> 1
A195: Raisins | C195: g | D195: 4 | E195: 298 | F195: 0.6 | G195: 68 | H195: 68 | I195: 2.5 | J195: 0.05 | K195: 0.1 | O195: of:=COM.MICROSOFT.IFS([.D195]>3;"";[.C195]="g";1;[.C195]="ml";1;1;"") -> 
A196: Red Wine 13 vol% (dry) | C196: ml | D196: 1 | E196: 85 | G196: 0.69 | H196: 0.69 | K196: 0.77 | O196: of:=COM.MICROSOFT.IFS([.D196]>3;"";[.C196]="g";1;[.C196]="ml";1;1;"") -> 1
A197: Rice pudding (classic) [REWE] | C197: g | D197: 1 | E197: 109 | F197: 2.4 | G197: 18.4 | H197: 9.3 | I197: 3.4 | J197: 0.1 | K197: of:=[.H197]/100 -> 0.093 | M197: 1 cup = 200g | O197: of:=COM.MICROSOFT.IFS([.D197]>3;"";[.C197]="g";1;[.C197]="ml";1;1;"") -> 1
A198: Ricotta 9% fat (33% DM) [REWE Marca Italia] | C198: g | D198: 1 | E198: 134 | F198: 9 | G198: 3.2 | H198: 3.2 | I198: 10 | J198: 0.16 | K198: of:=[.H198]/100 -> 0.032 | L198: of:=([.G198]+[.I198]+[.J198])*1.11 -> 14.8296 | O198: of:=COM.MICROSOFT.IFS([.D198]>3;"";[.C198]="g";1;[.C198]="ml";1;1;"") -> 1
A199: Rothaus Radler Zäpfle 2.4 vol% (0.33l) | C199: ml | D199: 1 | E199: 34 | F199: 0.5 | G199: 5.3 | H199: 4.8 | K199: of:=[.H199]/100+0.024*0.789*7.4 -> 0.1881264 | O199: of:=COM.MICROSOFT.IFS([.D199]>3;"";[.C199]="g";1;[.C199]="ml";1;1;"") -> 1
A200: Sake 15 vol% | C200: g | D200: 1 | E200: 134 | G200: 5 | J200: 0 | K200: 0.87 | O200: of:=COM.MICROSOFT.IFS([.D200]>3;"";[.C200]="g";1;[.C200]="ml";1;1;"") -> 1
A201: Salt | C201: g | D201: 2 | J201: 100 | K201: 5.9 | M201: of:=COM.MICROSOFT.CONCAT(ROUND([.B201]*10/0.4+0.8); " quick shakes (with my shaker)") -> 1 quick shakes (with my shaker) | O201: of:=COM.MICROSOFT.IFS([.D201]>3;"";[.C201]="g";1;[.C201]="ml";1;1;"") -> 1
A202: Salty Prezels [Huober/REWE] | C202: g | D202: 4 | E202: 397 | F202: 6.2 | G202: 72.3 | H202: 2.6 | I202: 11.3 | J202: 4.9 | M202: 1 pretzel = 2g | O202: of:=COM.MICROSOFT.IFS([.D202]>3;"";[.C202]="g";1;[.C202]="ml";1;1;"") -> 
A203: Salty Stability [Inulin / GMS / CMC / Guar / XG / Salt] | C203: g | D203: 2 | E203: 267.466666666667 | F203: 3.624 | G203: 88.4333333333333 | H203: 5.86666666666667 | I203: 0.3 | J203: 3.50533333333333 | K203: 0.055852 | M203: of:=COM.MICROSOFT.CONCAT("*not-as-good substitute:* ";ROUND([.B203]/15*1.5;1);"g guar, ";ROUND([.B203]/15*0.5;1);"g xanthan, and ";ROUND([.B203]/15*0.5;1);"g salt") -> *not-as-good substitute:* 0g guar, 0g xanthan, and 0g salt | N203: 73.8 | O203: of:=COM.MICROSOFT.IFS([.D203]>3;"";[.C203]="g";1;[.C203]="ml";1;1;"") -> 1
A204: Scandic Bärgløgg 11 vol% [Katlenburger] | C204: ml | D204: 1 | E204: 120 | K204: of:=[.H204]/100+0.11*0.789*7.4 -> 0.642246 | M204: 1 bottle = 750ml | O204: of:=COM.MICROSOFT.IFS([.D204]>3;"";[.C204]="g";1;[.C204]="ml";1;1;"") -> 1
A205: Schwartau “Black Cherry” (Extra Zero) | C205: g | D205: 5 | E205: 59 | F205: 0.2 | G205: 15.4 | H205: 7.1 | I205: 0.5 | J205: 0.03 | M205: of:=COM.MICROSOFT.CONCAT("fruit spread, no added sugar; add as a topping [";ROUND([.E205]*[.B205]/100); "kcal, ";ROUND([.H205]*[.B205]/100;1); "g sugar]") -> fruit spread, no added sugar; add as a topping [0kcal, 0g sugar]
A206: Sesame oil (roasted) [Diamond] | C206: ml | D206: 1 | E206: 828 | F206: 92 | G206: 0.5 | H206: 0.5 | I206: 0.5 | J206: 0.01 | O206: of:=COM.MICROSOFT.IFS([.D206]>3;"";[.C206]="g";1;[.C206]="ml";1;1;"") -> 1
A207: Skim milk 1.5% [Weihenstephan] | C207: ml | D207: 1 | E207: 47 | F207: 1.5 | G207: 4.9 | H207: 4.9 | I207: 3.5 | J207: 0.11 | K207: of:=[.H207]/100 -> 0.049 | L207: of:=(100-[.F207])*0.093 -> 9.1605 | O207: of:=COM.MICROSOFT.IFS([.D207]>3;"";[.C207]="g";1;[.C207]="ml";1;1;"") -> 1
A208: Skim milk powder 1:10 (SMP) [Vita2You] | C208: g | D208: 2 | E208: 358 | F208: 0.97 | G208: 50.5 | H208: 50.5 | I208: 35 | J208: 1 | K208: of:=[.H208]/100 -> 0.505 | L208: of:=95-[.F208] -> 94.03 | O208: of:=COM.MICROSOFT.IFS([.D208]>3;"";[.C208]="g";1;[.C208]="ml";1;1;"") -> 1
A209: Skyr “Vanilla” [Milsani / Aldi] | C209: ml | D209: 1 | E209: 77 | F209: 0.2 | G209: 9.5 | H209: 8.6 | I209: 8.8 | J209: 0.13 | K209: of:=[.H209]/100 -> 0.086 | L209: of:=100-82-[.F209] -> 17.8 | M209: 500g container; vanilla / blueberry/ cherry / strawberry flavors | O209: of:=COM.MICROSOFT.IFS([.D209]>3;"";[.C209]="g";1;[.C209]="ml";1;1;"") -> 1
A210: Skyr (unflavored) [Milsani / Aldi] | C210: ml | D210: 1 | E210: 65 | F210: 0.2 | G210: 4.4 | H210: 4.4 | I210: 10.6 | J210: 0.15 | K210: of:=[.H210]/100 -> 0.044 | L210: of:=100-82-[.F210] -> 17.8 | M210: 82% water; 500g container | O210: of:=COM.MICROSOFT.IFS([.D210]>3;"";[.C210]="g";1;[.C210]="ml";1;1;"") -> 1
A211: Skyr [arla] | C211: ml | D211: 1 | E211: 63 | F211: 0.2 | G211: 4 | H211: 4 | I211: 10.6 | J211: 0.14 | K211: of:=[.H211]/100 -> 0.04 | L211: of:=100-82-[.F211] -> 17.8 | M211: 82% water; 450g container | O211: of:=COM.MICROSOFT.IFS([.D211]>3;"";[.C211]="g";1;[.C211]="ml";1;1;"") -> 1
A212: Soda syrup “7up zero” [Sodastream] | C212: ml | D212: 1 | E212: 8 | F212: 0 | G212: 0 | H212: 0 | I212: 0 | J212: 1.04 | M212: 440ml bottle (1:19, yields 9l) | O212: of:=COM.MICROSOFT.IFS([.D212]>3;"";[.C212]="g";1;[.C212]="ml";1;1;"") -> 1
A213: Soda syrup “afri cola zero” [Sodapop] | C213: ml | D213: 1 | E213: 0 | F213: 0 | G213: 0 | H213: 0 | I213: 0 | J213: 0.01 | M213: 500ml bottle (1:19, yields 10l) | O213: of:=COM.MICROSOFT.IFS([.D213]>3;"";[.C213]="g";1;[.C213]="ml";1;1;"") -> 1
A214: Soda syrup “Schwipp Schwap zero” [Sodastream] | C214: ml | D214: 1 | E214: 24 | F214: 0 | G214: 0 | H214: 0 | I214: 0 | J214: 0.48 | M214: 440ml bottle (1:19, yields 9l) | O214: of:=COM.MICROSOFT.IFS([.D214]>3;"";[.C214]="g";1;[.C214]="ml";1;1;"") -> 1
A215: Soda syrup “Squee zero Raspberry” [IronMaxx] | C215: ml | D215: 1 | E215: 69 | F215: 0 | G215: 1.8 | H215: 0 | I215: 0 | J215: 1.3 | M215: 65ml bottle (4:500, yields 8l) | O215: of:=COM.MICROSOFT.IFS([.D215]>3;"";[.C215]="g";1;[.C215]="ml";1;1;"") -> 1
A216: Sorbitol | C216: g | D216: 2 | E216: 250 | G216: 99.8 | H216: 0 | K216: 1.9 | M216: POD 60%, GI 9 | N216: 50 | O216: of:=COM.MICROSOFT.IFS([.D216]>3;"";[.C216]="g";1;[.C216]="ml";1;1;"") -> 1
A217: Soured milk 3.5% [Schwälbchen] | C217: g | D217: 1 | E217: 64 | F217: 3.5 | G217: 4 | H217: 4 | I217: 3.3 | J217: 0.13 | K217: of:=[.H217]/100 -> 0.04 | L217: of:=12-[.F217] -> 8.5 | M217: 500g container | O217: of:=COM.MICROSOFT.IFS([.D217]>3;"";[.C217]="g";1;[.C217]="ml";1;1;"") -> 1
A218: Soy milk 1.6% (sugar-free) [Berief] | C218: ml | D218: 1 | E218: 30 | F218: 1.6 | G218: 0.9 | H218: 0 | I218: 3 | J218: 0.08 | L218: 4 | O218: of:=COM.MICROSOFT.IFS([.D218]>3;"";[.C218]="g";1;[.C218]="ml";1;1;"") -> 1
A219: Soy protein isolate (nature) [Powerstar] | C219: g | D219: 2 | E219: 372 | F219: 1 | G219: 1 | H219: 0 | I219: 89.8 | J219: 2.5 | L219: 93 | M219: 1kg bag, unsweetened, unflavored | O219: of:=COM.MICROSOFT.IFS([.D219]>3;"";[.C219]="g";1;[.C219]="ml";1;1;"") -> 1
A220: Soy sauce | C220: ml | D220: 1 | E220: 75 | F220: 0 | G220: 7.4 | H220: 6.7 | I220: 7.2 | J220: 17.1 | K220: of:=[.H220]/100 -> 0.067 | O220: of:=COM.MICROSOFT.IFS([.D220]>3;"";[.C220]="g";1;[.C220]="ml";1;1;"") -> 1
A221: Stevia drops “natural” [Nick’s] | C221: drops | D221: 3 | M221: to taste • unflavored | O221: of:=COM.MICROSOFT.IFS([.D221]>3;"";[.C221]="g";1;[.C221]="ml";1;1;"") -> 
A222: Stollen, coarsely cubed [REWE] | C222: g | D222: 4 | E222: 388 | F222: 15 | G222: 58 | H222: 33 | I222: 4.4 | J222: 0.38 | M222: of:=COM.MICROSOFT.CONCAT("add as a mix-in [";ROUND([.E222]*[.B222]/100); "kcal, ";ROUND([.H222]*[.B222]/100;1); "g sugar]") -> add as a mix-in [0kcal, 0g sugar] | O222: 0
A223: Strawberries | C223: g | D223: 1 | E223: 31 | F223: 0.4 | G223: 5.8 | H223: 5.7 | I223: 0.8 | J223: 0 | K223: of:=[.H223]/100 -> 0.057 | O223: of:=COM.MICROSOFT.IFS([.D223]>3;"";[.C223]="g";1;[.C223]="ml";1;1;"") -> 1
A224: Strawberry powder [Supergarden] | C224: g | D224: 2 | E224: 287 | F224: 3.7 | G224: 50.9 | H224: 50.6 | I224: 7.6 | J224: 0 | K224: of:=[.H224]/100 -> 0.506 | O224: of:=COM.MICROSOFT.IFS([.D224]>3;"";[.C224]="g";1;[.C224]="ml";1;1;"") -> 1
A225: Strawberry slices freeze-dried [EWL] | C225: g | D225: 4 | E225: 300 | F225: 3.3 | G225: 48 | H225: 48 | I225: 7 | J225: 0.01 | M225: Mix-in for a full tub (2 servings) | O225: of:=COM.MICROSOFT.IFS([.D225]>3;"";[.C225]="g";1;[.C225]="ml";1;1;"") -> 
A226: Sugar | C226: g | D226: 2 | E226: 387 | G226: 100 | H226: 100 | K226: 1 | O226: of:=COM.MICROSOFT.IFS([.D226]>3;"";[.C226]="g";1;[.C226]="ml";1;1;"") -> 1
A227: Sultanas (organic) [Biojoy] | C227: g | D227: 4 | E227: 298 | F227: 0.6 | G227: 68 | H227: 67 | I227: 2.5 | J227: 0.02 | K227: of:=[.H227]/100 -> 0.67 | M227: of:=COM.MICROSOFT.CONCAT("add chopped as a mix-in [";ROUND([.E227]*[.B227]/100); "kcal, ";ROUND([.H227]*[.B227]/100); "g sugar]") -> add chopped as a mix-in [0kcal, 0g sugar] | O227: of:=COM.MICROSOFT.IFS([.D227]>3;"";[.C227]="g";1;[.C227]="ml";1;1;"") -> 
A228: Sweet potato (baked) | C228: g | D228: 1 | E228: 90 | F228: 0.1 | G228: 21 | H228: 6.5 | I228: 2 | J228: 0.04 | M228: 1 potato ~130g | O228: of:=COM.MICROSOFT.IFS([.D228]>3;"";[.C228]="g";1;[.C228]="ml";1;1;"") -> 1
A229: Sweetener Tablets [LightSüß] | C229: pcs | D229: 2 | E229: 0 | M229: 1 tablet ≃ 4g sugar
A230: SweEX (Erythritol + Xylitol 3:2) | C230: g | D230: 2 | E230: 109.6 | G230: 100 | K230: 2.56 | M230: of:=COM.MICROSOFT.CONCAT("*alternative:* ";ROUND([.B230]*1.33);"g allulose or dextrose") -> *alternative:* 0g allulose or dextrose | N230: 100 | O230: of:=COM.MICROSOFT.IFS([.D230]>3;"";[.C230]="g";1;[.C230]="ml";1;1;"") -> 1
A231: Syrup Caramel (low-sugar) [Sukrin] | C231: ml | D231: 3 | E231: 149 | F231: 0 | G231: 21 | H231: 1.8 | I231: 0 | J231: 0.07 | M231: 14% sorbitol, erythritol, stevia | N231: 10 | O231: of:=COM.MICROSOFT.IFS([.D231]>3;"";[.C231]="g";1;[.C231]="ml";1;1;"") -> 1
A232: Syrup Maple-flavored (low-sugar) [Sukrin] | C232: ml | D232: 3 | E232: 149 | F232: 0 | G232: 21 | H232: 1.8 | I232: 0 | J232: 0.07 | M232: 14% sorbitol, erythritol, stevia | N232: 10 | O232: of:=COM.MICROSOFT.IFS([.D232]>3;"";[.C232]="g";1;[.C232]="ml";1;1;"") -> 1
A233: tajin with lime | C233: g | D233: 5 | E233: 6 | F233: 0.4 | G233: 0.6 | H233: 0 | I233: 0.2 | J233: 1.42 | M233: 142g shaker; www.tajin.com | O233: of:=COM.MICROSOFT.IFS([.D233]>3;"";[.C233]="g";1;[.C233]="ml";1;1;"") -> 
A234: Tapioca syrup | C234: ml | D234: 1 | E234: 312 | F234: 0 | G234: 78 | H234: 33 | I234: 0 | J234: 0 | K234: of:=[.H234]/100 -> 0.33 | O234: of:=COM.MICROSOFT.IFS([.D234]>3;"";[.C234]="g";1;[.C234]="ml";1;1;"") -> 1
A235: Tara gum (E417) | C235: g | D235: 2 | E235: 185 | F235: 0.31 | G235: 87 | H235: 0 | I235: 2.26 | J235: 0 | O235: of:=COM.MICROSOFT.IFS([.D235]>3;"";[.C235]="g";1;[.C235]="ml";1;1;"") -> 1
A236: Tequila 38 vol% | C236: g | D236: 1 | E236: 266 | K236: of:=[.H236]/100+0.38*0.789*7.4 -> 2.218668 | M236: 1 bottle = 70cl | O236: of:=COM.MICROSOFT.IFS([.D236]>3;"";[.C236]="g";1;[.C236]="ml";1;1;"") -> 1
A237: Tofu (plain) [Berief] | C237: g | D237: 1 | E237: 137 | F237: 8 | G237: 0.7 | H237: 0.5 | I237: 15.4 | J237: 0.03 | L237: of:=([.G237]+[.I237])*1.05 -> 16.905 | M237: Package of 2x200g | O237: of:=COM.MICROSOFT.IFS([.D237]>3;"";[.C237]="g";1;[.C237]="ml";1;1;"") -> 1
A238: Tofu (plain) [REWE Bio] | C238: g | D238: 1 | E238: 129 | F238: 7.5 | G238: 1.8 | H238: 0.5 | I238: 13 | J238: 0.2 | L238: of:=([.G238]+[.I238])*1.05 -> 15.54 | M238: Package of 2x200g | O238: of:=COM.MICROSOFT.IFS([.D238]>3;"";[.C238]="g";1;[.C238]="ml";1;1;"") -> 1
A239: Tofu (silken) [REWE] | C239: g | D239: 1 | E239: 48 | F239: 2.1 | G239: 1.8 | H239: 0.5 | I239: 5.3 | J239: 0.01 | L239: of:=([.G239]+[.I239])*1.05 -> 7.455 | O239: of:=COM.MICROSOFT.IFS([.D239]>3;"";[.C239]="g";1;[.C239]="ml";1;1;"") -> 1
A240: Topfen / Quark 0.6% [Berchtesgadener] | C240: g | D240: 1 | E240: 70 | F240: 0.6 | G240: 3.6 | H240: 3.6 | I240: 11.9 | J240: 0.08 | K240: of:=[.H240]/100 -> 0.036 | L240: of:=12-[.F240] -> 11.4 | M240: 250g container; *US alternative:* low-fat cream cheese | O240: of:=COM.MICROSOFT.IFS([.D240]>3;"";[.C240]="g";1;[.C240]="ml";1;1;"") -> 1
A241: Topfen / Quark 14.4% [Berchtesgadener] | C241: g | D241: 1 | E241: 179 | F241: 14.4 | G241: 3.6 | H241: 3.6 | I241: 8.4 | J241: 0.08 | K241: of:=[.H241]/100 -> 0.036 | L241: of:=21-[.F241] -> 6.6 | M241: of:=COM.MICROSOFT.CONCAT("250g container; *alternative:* ";ROUND([.B241]*0.75);"g ricotta 9% and ";ROUND([.B241]*0.25);"ml cream 32%") -> 250g container; *alternative:* 0g ricotta 9% and 0ml cream 32% | O241: of:=COM.MICROSOFT.IFS([.D241]>3;"";[.C241]="g";1;[.C241]="ml";1;1;"") -> 1
A242: Topfen / Quark 4.5% [Berchtesgadener] | C242: g | D242: 1 | E242: 101 | F242: 4.5 | G242: 3.7 | H242: 3.7 | I242: 11 | J242: 0.08 | K242: of:=[.H242]/100 -> 0.037 | L242: of:=21-[.F242] -> 16.5 | O242: of:=COM.MICROSOFT.IFS([.D242]>3;"";[.C242]="g";1;[.C242]="ml";1;1;"") -> 1
A243: Trehalose [SaporePuro] | C243: g | D243: 2 | E243: 355 | F243: 0 | G243: 89 | H243: 89 | I243: 0 | J243: 0.03 | K243: 1 | M243: POD = 45%; GI = 38 | O243: of:=COM.MICROSOFT.IFS([.D243]>3;"";[.C243]="g";1;[.C243]="ml";1;1;"") -> 1
A244: Ube Yam Root powder [Fil Choice] | C244: g | D244: 2 | E244: 382 | F244: 0.6 | G244: 83 | H244: 9.5 | I244: 6.1 | J244: 0.3 | K244: of:=[.H244]/100 -> 0.095 | M244: like vanilla+pistachio | O244: of:=COM.MICROSOFT.IFS([.D244]>3;"";[.C244]="g";1;[.C244]="ml";1;1;"") -> 1
A245: Vanilla Bean Powder [InterVanilla] | C245: g | D245: 2 | E245: 288 | F245: 0.1 | G245: 13 | H245: 13 | I245: 0 | J245: 0 | O245: of:=COM.MICROSOFT.IFS([.D245]>3;"";[.C245]="g";1;[.C245]="ml";1;1;"") -> 1
A246: Vanilla Extract (w/ alcohol) [Native Vanilla] | C246: ml | D246: 1 | E246: 300 | K246: of:=7.4*0.3 -> 2.22 | O246: of:=COM.MICROSOFT.IFS([.D246]>3;"";[.C246]="g";1;[.C246]="ml";1;1;"") -> 1
A247: Vodka 40 vol% (measured by volume) | C247: ml | D247: 1 | E247: 225 | K247: of:=7.4*0.78945*0.4 -> 2.336772 | O247: of:=COM.MICROSOFT.IFS([.D247]>3;"";[.C247]="g";1;[.C247]="ml";1;1;"") -> 1
A248: Vodka 40 vol% (measured by weigth) | C248: g | D248: 1 | E248: of:=40*7 -> 280 | K248: of:=7.4*0.4 -> 2.96 | O248: of:=COM.MICROSOFT.IFS([.D248]>3;"";[.C248]="g";1;[.C248]="ml";1;1;"") -> 1
A249: Wafer Rolls [REWE] | C249: g | D249: 5 | E249: 523 | F249: 28 | G249: 63 | H249: 31 | I249: 5.1 | J249: 0.57 | M249: of:=COM.MICROSOFT.CONCAT("1pc = 5g [";ROUND([.E249]*[.B249]/100); "kcal, ";ROUND([.H249]*[.B249]/100; 1); "g sugar]") -> 1pc = 5g [0kcal, 0g sugar]
A250: Walnuts (organic) [Biojoy] | C250: g | D250: 5 | E250: 675 | F250: 63 | G250: 11 | H250: 6.9 | I250: 14 | J250: 0.01 | K250: of:=[.H250]/100 -> 0.069 | M250: of:=COM.MICROSOFT.CONCAT("add as a topping [";ROUND([.E250]*[.B250]/100); "kcal, ";ROUND([.H250]*[.B250]/100;1); "g sugar]") -> add as a topping [0kcal, 0g sugar]
A251: Water (boiling) | C251: ml | D251: 0 | O251: of:=COM.MICROSOFT.IFS([.D251]>3;"";[.C251]="g";1;[.C251]="ml";1;1;"") -> 1
A252: Water (cold) | C252: ml | D252: 1 | O252: of:=COM.MICROSOFT.IFS([.D252]>3;"";[.C252]="g";1;[.C252]="ml";1;1;"") -> 1
A253: Water (hot) | C253: ml | D253: 0 | O253: of:=COM.MICROSOFT.IFS([.D253]>3;"";[.C253]="g";1;[.C253]="ml";1;1;"") -> 1
A254: Water to MAX line | C254: ml | D254: 3 | O254: of:=COM.MICROSOFT.IFS([.D254]>3;"";[.C254]="g";1;[.C254]="ml";1;1;"") -> 1
A255: Watermelon | C255: g | D255: 1 | E255: 30 | F255: 0.15 | G255: 7.6 | H255: 6.2 | I255: 0.61 | J255: 0 | K255: of:=[.H255]/100 -> 0.062 | M255: 91% water | O255: of:=COM.MICROSOFT.IFS([.D255]>3;"";[.C255]="g";1;[.C255]="ml";1;1;"") -> 1
A256: Watermelon | C256: g | D256: 6 | E256: 30 | F256: 0.2 | G256: 7.6 | H256: 6.2 | I256: 0.6 | K256: of:=[.H256]/100 -> 0.062 | M256: of:=COM.MICROSOFT.CONCAT("fresh [";ROUND([.E256]*[.B256]/100); "kcal, ";ROUND([.H256]*[.B256]/100); "g sugar]") -> fresh [0kcal, 0g sugar] | O256: of:=COM.MICROSOFT.IFS([.D256]>3;"";[.C256]="g";1;[.C256]="ml";1;1;"") -> 
A257: Waxy Maize Starch (E1442) [Ultratex] | C257: g | D257: 2 | E257: 391 | F257: 0.15 | G257: 97 | H257: 0 | I257: 0.5 | J257: 0.5 | M257: dissolves easily; use 1-5% | O257: of:=COM.MICROSOFT.IFS([.D257]>3;"";[.C257]="g";1;[.C257]="ml";1;1;"") -> 1
A258: Whey + Casein protein (grass-fed) [Vilgain] | C258: g | D258: 2 | E258: 384 | F258: 4.6 | G258: 5.7 | H258: 5.6 | I258: 80 | J258: 0.5 | K258: of:=[.H258]/100 -> 0.056 | L258: of:=95-[.F258] -> 90.4 | M258: with stevia | O258: of:=COM.MICROSOFT.IFS([.D258]>3;"";[.C258]="g";1;[.C258]="ml";1;1;"") -> 1
A259: Whey protein Vanilla [MaxiNutrition] | C259: g | D259: 2 | E259: 392 | F259: 5.8 | G259: 6.2 | H259: 5.3 | I259: 78 | J259: 0.57 | K259: of:=[.H259]/100 -> 0.053 | L259: of:=95-[.F259] -> 89.2 | O259: of:=COM.MICROSOFT.IFS([.D259]>3;"";[.C259]="g";1;[.C259]="ml";1;1;"") -> 1
A260: White Wine dry 12 vol% | C260: ml | D260: 1 | E260: 83 | G260: 2.7 | H260: 0.8 | I260: 0.1 | K260: of:=[.H260]/100+0.12*0.789*7.4 -> 0.708632 | O260: of:=COM.MICROSOFT.IFS([.D260]>3;"";[.C260]="g";1;[.C260]="ml";1;1;"") -> 1
A261: Xanthan gum (E415, XG) | C261: g | D261: 2 | E261: 320 | G261: 78 | I261: 6 | J261: 1 | M261: 1tsp ≈ 2.8g | O261: of:=COM.MICROSOFT.IFS([.D261]>3;"";[.C261]="g";1;[.C261]="ml";1;1;"") -> 1
A262: Xylitol (E967) | C262: g | D262: 2 | E262: 238 | G262: 100 | K262: 2.2 | M262: POD = 100%; GI = 7 | N262: 100 | O262: of:=COM.MICROSOFT.IFS([.D262]>3;"";[.C262]="g";1;[.C262]="ml";1;1;"") -> 1
A263: Yogurt 3.5% [REWE] | C263: g | D263: 1 | E263: 70 | F263: 3.5 | G263: 4.8 | H263: 4.8 | I263: 4.8 | J263: 0.15 | K263: of:=[.H263]/100 -> 0.048 | L263: of:=([.G263]+[.I263]+[.J263])*1.11 -> 10.8225 | O263: of:=COM.MICROSOFT.IFS([.D263]>3;"";[.C263]="g";1;[.C263]="ml";1;1;"") -> 1
A264: Yogurt 8% Apricot [Lyttos / Aldi] | C264: g | D264: 1 | E264: 131 | F264: 8 | G264: 12.2 | H264: 11.5 | I264: 2.6 | J264: 0.09 | K264: of:=[.H264]/100 -> 0.115 | L264: of:=([.G264]+[.I264]+[.J264])*1.11 -> 16.5279 | O264: of:=COM.MICROSOFT.IFS([.D264]>3;"";[.C264]="g";1;[.C264]="ml";1;1;"") -> 1
A265: Yogurt 8% Cherry [Lyttos / Aldi] | C265: g | D265: 1 | E265: 128 | F265: 7.9 | G265: 11.7 | H265: 10.9 | I265: 2.6 | J265: 0.1 | K265: of:=[.H265]/100 -> 0.109 | L265: of:=([.G265]+[.I265]+[.J265])*1.11 -> 15.984 | O265: of:=COM.MICROSOFT.IFS([.D265]>3;"";[.C265]="g";1;[.C265]="ml";1;1;"") -> 1
A266: Yogurt mild 4% [REWE Bio] | C266: ml | D266: 1 | E266: 71 | F266: 3.8 | G266: 5 | H266: 5 | I266: 4.1 | J266: 0.15 | K266: of:=[.H266]/100 -> 0.05 | L266: of:=([.G266]+[.I266]+[.J266])*1.11 -> 10.2675 | M266: 500g container | O266: of:=COM.MICROSOFT.IFS([.D266]>3;"";[.C266]="g";1;[.C266]="ml";1;1;"") -> 1
A267: Zucchini (raw, peeled) | C267: g | D267: 1 | E267: 17 | F267: 0.3 | G267: 3.4 | H267: 2.1 | I267: 1.2 | J267: 0 | O267: of:=COM.MICROSOFT.IFS([.D267]>3;"";[.C267]="g";1;[.C267]="ml";1;1;"") -> 1